,autor,libro,metaTL,poema,fragmento,destinatario,texto,AA#1-Espasa(1989)-Roman num.,AA#2-Espasa(1989)-Arabian num.,MM#1-Etc.,MM#2-Etc.,,,,,,,
50288,Antonio Machado,02-Campos de Castilla (1907-1917),,(El mañana efímero),,,"La España de charanga y pandereta, 
cerrado y sacristía, 
devota de Frascuelo y de María, 
de espíritu burlón y de alma quieta, 
ha de tener su mármol y su día, 
su infalible mañana y su poeta. 
El vano ayer engendrará un mañana 
vacío y ¡por ventura! pasajero. 
Será un joven lechuzo y tarambana, 
un sayón con hechuras de bolero,
a la moda de Francia realista, 
un poco al uso de París pagano, 
y al estilo de España especialista 
en el vicio al alcance de la mano. 
Esa España inferior que ora y bosteza,
vieja y tahur, zaragatera y triste; 
esa España inferior que ora y embiste, 
cuando se digna usar de la cabeza, 
aún tendrá luengo parto de varones 
amantes de sagradas tradiciones 
y de sagradas formas y maneras; 
florecerán las barbas apostólicas, 
y otras calvas en otras calaveras 
brillarán, venerables y católicas. 
El vano ayer engendrará un mañana 
vacío y ¡por ventura! pasajero, 
la sombra de un lechuzo tarambana, 
de un sayón con hechuras de bolero, 
el vacuo ayer dará un mañana huero. 
Como la náusea de un borracho ahíto
de vino malo, un rojo sol corona 
de heces turbias las cumbres de granito; 
hay un mañana estomagante escrito
en la tarde pragmática y dulzona. 
Mas otra España nace, 
la España del cincel y de la maza, 
con esa eterna juventud que se hace 
del pasado macizo de la raza. 
Una España implacable y redentora, 
España que alborea 
con un hacha en la mano vengadora, 
España de la rabia y de la idea. 
 (1913.)",CXXXV,135,,,,,,,,,
50289,Antonio Machado,02-Campos de Castilla (1907-1917),,(Proverbios y cantares),I,,"Nunca perseguí la gloria 
ni dejar en la memoria 
de los hombres mi canción; 
yo amo los mundos sutiles, 
ingrávidos y gentiles 
como pompas de jabón. 
Me gusta verlos pintarse 
de sol y grana, volar 
bajo el cielo azul, temblar 
súbitamente y quebrarse.",CXXXVI,136,,,,,,,,,
50290,Antonio Machado,02-Campos de Castilla (1907-1917),,(Proverbios y cantares),II,,"¿Para qué llamar caminos 
a los surcos del azar? . . . 
Todo el que camina anda, 
como Jesús, sobre el mar.",CXXXVI,136,,,,,,,,,
50291,Antonio Machado,02-Campos de Castilla (1907-1917),,(Proverbios y cantares),III,,"A quien nos justifica nuestra desconfianza 
llamamos enemigo, ladrón de una esperanza. 
Jamás perdona el necio si ve la nuez vacía 
que dio a cascar al diente de la sabiduría.
",CXXXVI,136,,,,,,,,,
50292,Antonio Machado,02-Campos de Castilla (1907-1917),,(Proverbios y cantares),IV,,"Nuestras horas son minutos 
cuando esperamos saber, 
y siglos cuando sabemos 
lo que se puede aprender.",CXXXVI,136,,,,,,,,,
50293,Antonio Machado,02-Campos de Castilla (1907-1917),,(Proverbios y cantares),V,,"Ni vale nada el fruto 
cogido sin sazón . . . 
Ni aunque te elogie un bruto 
ha de tener razón.",CXXXVI,136,,,,,,,,,
50294,Antonio Machado,02-Campos de Castilla (1907-1917),,(Proverbios y cantares),VI,,"De lo que llaman los hombres 
virtud, justicia y bondad, 
una mitad es envidia, 
y la otra, no es caridad.",CXXXVI,136,,,,,,,,,
50295,Antonio Machado,02-Campos de Castilla (1907-1917),,(Proverbios y cantares),VII,,"Yo he visto garras fieras en las pulidas manos; 
conozco grajos mélicos y líricos marranos . . . 
El más truhán se lleva la mano al corazón, 
y el bruto más espeso se carga de razón.",CXXXVI,136,,,,,,,,,
50296,Antonio Machado,02-Campos de Castilla (1907-1917),,(Proverbios y cantares),VIII,,"En preguntar lo que sabes 
el tiempo no has de perder . . . 
Y a preguntas sin respuesta 
¿quién te podrá responder?",CXXXVI,136,,,,,,,,,
50297,Antonio Machado,02-Campos de Castilla (1907-1917),,(Proverbios y cantares),IX,,"El hombre, a quien el hambre de la rapiña acucia, 
de ingénita malicia y natural astucia, 
formó la inteligencia y acaparó la tierra. 
¡Y aun la verdad proclama! ¡Supremo ardid de guerra!",CXXXVI,136,,,,,,,,,
50298,Antonio Machado,02-Campos de Castilla (1907-1917),,(Proverbios y cantares),X,,"La envidia de la virtud 
hizo a Caín criminal. 
¡Gloria a Caín! Hoy el vicio 
es lo que se envidia más.",CXXXVI,136,,,,,,,,,
50299,Antonio Machado,02-Campos de Castilla (1907-1917),,(Proverbios y cantares),XI,,"La mano del piadoso nos quita siempre honor; 
mas nunca ofende al darnos su mano el lidiador. 

Virtud es fortaleza, ser bueno es ser valiente; 
escudo, espada y maza llevar bajo la frente, 
porque el valor honrado de todas armas viste: 
no sólo para, hiere, y más que aguarda, embiste. 

Que la piqueta arruine, y el látigo flagele; 
la fragua ablande el hierro, la lima pula y gaste, 
y que el buril burile, y que el cincel cincele, 
la espada punce y hienda y el gran martillo aplaste.",CXXXVI,136,,,,,,,,,
50300,Antonio Machado,02-Campos de Castilla (1907-1917),,(Proverbios y cantares),XII,,"¡Ojos que a luz se abrieron 
un día para, después, 
ciegos tornar a la tierra, 
hartos de mirar sin ver!",CXXXVI,136,,,,,,,,,
50301,Antonio Machado,02-Campos de Castilla (1907-1917),,(Proverbios y cantares),XIII,,"Es el mejor de los buenos 
quien sabe que en esta vida 
todo es cuestión de medida: 
un poco más, algo menos . . .",CXXXVI,136,,,,,,,,,
50302,Antonio Machado,02-Campos de Castilla (1907-1917),,(Proverbios y cantares),XIV,,"Virtud es la alegría que alivia el corazón
más grave y desarruga el ceño de Catón
El bueno es el que guarda, cual venta del camino,
para el sediento el agua, para el borracho el vino.",CXXXVI,136,,,,,,,,,
50303,Antonio Machado,02-Campos de Castilla (1907-1917),,(Proverbios y cantares),XV,,"Cantad conmigo en coro: Saber, nada sabemos, 
de arcano mar vinimos, a ignota mar iremos . . . 
Y entre los dos misterios está el enigma grave; 
tres arcas cierra una desconocida llave. 
La luz nada ilumina y el sabio nada enseña. 
¿Qué dice la palabra? ¿Qué el agua de la peña?",CXXXVI,136,,,,,,,,,
50304,Antonio Machado,02-Campos de Castilla (1907-1917),,(Proverbios y cantares),XVI,,"El hombre es por natura la bestia paradójica, 
un animal absurdo que necesita lógica. 
Creó de nada un mundo y, su obra terminada, 
«Ya estoy en el secreto—se dijo—, todo es nada.»",CXXXVI,136,,,,,,,,,
50305,Antonio Machado,02-Campos de Castilla (1907-1917),,(Proverbios y cantares),XVII,,"El hombre sólo es rico en hipocresía. 
En sus diez mil disfraces para engañar confía; 
y con la doble llave que guarda su mansión 
para la ajena hace ganzúa de ladrón.",CXXXVI,136,,,,,,,,,
50306,Antonio Machado,02-Campos de Castilla (1907-1917),,(Proverbios y cantares),XVIII,,"¡Ah, cuando yo era niño 
soñaba con los héroes de la Ilíada! 
Ayax era más fuerte que Diómedes, 
Héctor, más fuerte que Áyax, 
y Aquiles el más fuerte; porque era 
el más fuerte . . . ¡Inocencias de la infancia! 
¡Ah, cuando yo era niño 
soñaba con los héroes de la Ilíada!",CXXXVI,136,,,,,,,,,
50307,Antonio Machado,02-Campos de Castilla (1907-1917),,(Proverbios y cantares),XIX,,"El casca—nueces—vacías, 
Colón de cien vanidades, 
vive de supercherías 
que vende como verdades.",CXXXVI,136,,,,,,,,,
50308,Antonio Machado,02-Campos de Castilla (1907-1917),,(Proverbios y cantares),XX,,"¡Teresa, alma de fuego, 
Juan de la Cruz, espíritu de llama, 
por aquí hay mucho frío, padres, nuestros 
corazoncitos de Jesús se apagan!",CXXXVI,136,,,,,,,,,
50309,Antonio Machado,02-Campos de Castilla (1907-1917),,(Proverbios y cantares),XXI,,"Ayer soñé que veía 
a Dios y que a Dios hablaba; 
y soñé que Dios me oía . . . 
Después soñé que soñaba.",CXXXVI,136,,,,,,,,,
50310,Antonio Machado,02-Campos de Castilla (1907-1917),,(Proverbios y cantares),XXII,,"Cosas de hombres y mujeres, 
los amoríos de ayer, 
casi los tengo olvidados, 
si fueron alguna vez.",CXXXVI,136,,,,,,,,,
50311,Antonio Machado,02-Campos de Castilla (1907-1917),,(Proverbios y cantares),XXIII,,"No extrañéis, dulces amigos, 
que esté mi frente arrugada; 
yo vivo en paz con los hombres 
y en guerra con mis entrañas.",CXXXVI,136,,,,,,,,,
50312,Antonio Machado,02-Campos de Castilla (1907-1917),,(Proverbios y cantares),XXIV,,"De diez cabezas, nueve 
embisten y una piensa. 
Nunca extrañéis que un bruto 
se descuerne luchando por la idea.",CXXXVI,136,,,,,,,,,
50313,Antonio Machado,02-Campos de Castilla (1907-1917),,(Proverbios y cantares),XXV,,"Las abejas de las flores 
sacan miel, y melodía 
del amor, los ruiseñores; 
Dante y yo—perdón, señores—, 
trocamos—perdón, Lucía—, 
el amor en Teología.",CXXXVI,136,,,,,,,,,
50314,Antonio Machado,02-Campos de Castilla (1907-1917),,(Proverbios y cantares),XXVI,,"Poned sobre los campos 
un carbonero, un sabio y un poeta. 
Veréis cómo el poeta admira y calla, 
el sabio mira y piensa . . . 
Seguramente, el carbonero busca 
las moras o las setas. 
Llevadlos al teatro 
y sólo el carbonero no bosteza. 
Quien prefiere lo vivo a lo pintado 
es el hombre que piensa, canta o sueña. 
El carbonero tiene 
llena de fantasías la cabeza.",CXXXVI,136,,,,,,,,,
50315,Antonio Machado,02-Campos de Castilla (1907-1917),,(Proverbios y cantares),XXVII,,"¿Dónde está la utilidad 
de nuestras utilidades? 
Volvamos a la verdad: 
vanidad de vanidades.",CXXXVI,136,,,,,,,,,
50316,Antonio Machado,02-Campos de Castilla (1907-1917),,(Proverbios y cantares),XXVIII,,"Todo hombre tiene dos 
batallas que pelear: 
en sueños lucha con Dios; 
y despierto, con el mar.",CXXXVI,136,,,,,,,,,
50317,Antonio Machado,02-Campos de Castilla (1907-1917),,(Proverbios y cantares),XXIX,,"Caminante, son tus huellas 
el camino, y nada más; 
caminante, no hay camino, 
se hace camino al andar. 
Al andar se hace camino, 
y al volver la vista atrás 
se ve la senda que nunca 
se ha de volver a pisar. 
Caminante, no hay camino, 
sino estelas en la mar.",CXXXVI,136,,,,,,,,,
50318,Antonio Machado,02-Campos de Castilla (1907-1917),,(Proverbios y cantares),XXX,,"El que espera desespera, 
dice la voz popular. 
¡Qué verdad tan verdadera! 
 
La verdad es lo que es, 
y sigue siendo verdad 
aunque se piense al revés.",CXXXVI,136,,,,,,,,,
50319,Antonio Machado,02-Campos de Castilla (1907-1917),,(Proverbios y cantares),XXXI,,"Corazón, ayer sonoro, 
¿ya no suena 
tu monedilla de oro? 
Tu alcancía, 
antes que el tiempo la rompa,
¿se irá quedando vacía? 
Confiemos 
en que no será verdad 
nada de lo que sabemos.",CXXXVI,136,,,,,,,,,
50320,Antonio Machado,02-Campos de Castilla (1907-1917),,(Proverbios y cantares),XXXII,,"¡Oh fe del meditabundo! 
¡Oh fe después del pensar! 
Sólo si viene un corazón al mundo 
rebosa el vaso humano y se hincha el mar.",CXXXVI,136,,,,,,,,,
50321,Antonio Machado,02-Campos de Castilla (1907-1917),,(Proverbios y cantares),XXXIII,,"Soñé a Dios como una fragua 
de fuego, que ablanda el hierro, 
como un forjador de espadas, 
como un bruñidor de aceros, 
que iba firmando en las hojas 
de luz: Libertad.—Imperio.",CXXXVI,136,,,,,,,,,
50322,Antonio Machado,02-Campos de Castilla (1907-1917),,(Proverbios y cantares),XXXIV,,"Yo amo a Jesús, que nos dijo: 
Cielo y tierra pasarán. 
Cuando cielo y tierra pasen 
mi palabra quedará. 
¿Cuál fue, Jesús, tu palabra? 
¿Amor? ¿Perdón? ¿Caridad? 
Todas tus palabras fueron 
una palabra: Velad.",CXXXVI,136,,,,,,,,,
50323,Antonio Machado,02-Campos de Castilla (1907-1917),,(Proverbios y cantares),XXXV,,"Hay dos modos de conciencia: 
una es luz, y otra, paciencia. 
Una estriba en alumbrar 
un poquito el hondo mar; 
otra, en hacer penitencia 
con caña o red, y esperar 
el pez, como pescador. 
Dime tú: ¿Cuál es mejor? 
¿Conciencia de visionario
que mira en el hondo acuario 
peces vivos, 
fugitivos, 
que no se pueden pescar, 
o esa maldita faena 
de ir arrojando a la arena, 
muertos, los peces del mar?",CXXXVI,136,,,,,,,,,
50324,Antonio Machado,02-Campos de Castilla (1907-1917),,(Proverbios y cantares),XXXVI,,"Fe empirista. Ni somos ni seremos. 
Todo nuestro vivir es emprestado. 
Nada trajimos; nada llevaremos.",CXXXVI,136,,,,,,,,,
50325,Antonio Machado,02-Campos de Castilla (1907-1917),,(Proverbios y cantares),XXXVII,,"¿Dices que nada se crea? 
No te importe, con el barro 
de la tierra, haz una copa 
para que beba tu hermano.",CXXXVI,136,,,,,,,,,
50326,Antonio Machado,02-Campos de Castilla (1907-1917),,(Proverbios y cantares),XXXVIII,,"¿Dices que nada se crea?
Alfarero, a tus cacharros.
Haz tu copa y no te importe
si no puedes hacer barro.",CXXXVI,136,,,,,,,,,
50327,Antonio Machado,02-Campos de Castilla (1907-1917),,(Proverbios y cantares),XXXIX,,"Dicen que el ave divina 
trocada en pobre gallina, 
por obra de las tijeras 
de aquel sabio profesor 
(fue Kant un esquilador 
de las aves altaneras; 
toda su filosofía, 
un sport de cetrería), 
dicen que quiere saltar 
las tapias del corralón, 
y volar 
otra vez, hacia Platón. 
¡Hurra! ¡Sea! 
¡Feliz será quien lo vea!",CXXXVI,136,,,,,,,,,
50328,Antonio Machado,02-Campos de Castilla (1907-1917),,(Proverbios y cantares),XL,,"Sí, cada uno y todos sobre la tierra iguales: 
el ómnibus que arrastran dos pencos matalones, 
por el camino, a tumbos, hacia las estaciones, 
el ómnibus completo de viajeros banales, 
y en medio un hombre mudo, hipocondríaco, austero, 
a quien se cuentan cosas y a quien se ofrece vino . . . 
Y allá, cuando se llegue, ¿descenderá un viajero 
no más? ¿O habránse todos quedado en el camino?",CXXXVI,136,,,,,,,,,
50329,Antonio Machado,02-Campos de Castilla (1907-1917),,(Proverbios y cantares),XLI,,"Bueno es saber que los vasos 
nos sirven para beber; 
lo malo es que no sabemos 
para qué sirve la sed.",CXXXVI,136,,,,,,,,,
50330,Antonio Machado,02-Campos de Castilla (1907-1917),,(Proverbios y cantares),XLII,,"¿Dices que nada se pierde? 
Si esta copa de cristal 
se me rompe, nunca en ella 
beberé, nunca jamás.",CXXXVI,136,,,,,,,,,
50331,Antonio Machado,02-Campos de Castilla (1907-1917),,(Proverbios y cantares),XLIII,,"Dices que nada se pierde, 
y acaso dices verdad; 
pero todo lo perdemos 
y todo nos perderá.",CXXXVI,136,,,,,,,,,
50332,Antonio Machado,02-Campos de Castilla (1907-1917),,(Proverbios y cantares),XLIV,,"Todo pasa y todo queda; 
pero lo nuestro es pasar, 
pasar haciendo caminos, 
caminos sobre la mar.",CXXXVI,136,,,,,,,,,
50333,Antonio Machado,02-Campos de Castilla (1907-1917),,(Proverbios y cantares),XLV,,"Morir . . . ¿Caer como gota 
de mar en el mar inmenso? 
¿O ser lo que nunca ha sido: 
uno, sin sombra y sin sueño, 
un solitario que avanza 
sin camino y sin espejo?",CXXXVI,136,,,,,,,,,
50334,Antonio Machado,02-Campos de Castilla (1907-1917),,(Proverbios y cantares),XLVI,,"Anoche soñé que oía 
a Dios, gritándome: ¡Alerta! 
Luego era Dios quien dormía, 
y yo gritaba: ¡Despierta!",CXXXVI,136,,,,,,,,,
50335,Antonio Machado,02-Campos de Castilla (1907-1917),,(Proverbios y cantares),XLVII,,"Cuatro cosas tiene el hombre 
que no sirven en la mar: 
ancla, gobernalle y remos, 
y miedo de naufragar.",CXXXVI,136,,,,,,,,,
50336,Antonio Machado,02-Campos de Castilla (1907-1917),,(Proverbios y cantares),XLVIII,,"Mirando mi calavera 
un nuevo Hamlet dirá: 
He aquí un lindo fósil de una 
careta de carnaval.",CXXXVI,136,,,,,,,,,
50337,Antonio Machado,02-Campos de Castilla (1907-1917),,(Proverbios y cantares),XLIX,,"Ya noto, al paso que me torno viejo, 
que en el inmenso espejo, 
donde orgulloso me miraba un día, 
era el azogue lo que yo ponía. 
Al espejo del fondo de mi casa 
una mano fatal 
va rayendo el azogue, y todo pasa 
por él como la luz por el cristal.",CXXXVI,136,,,,,,,,,
50338,Antonio Machado,02-Campos de Castilla (1907-1917),,(Proverbios y cantares),L,,"—Nuestro español bosteza. 
¿Es hambre? ¿Sueño? ¿Hastío? 
Doctor, ¿tendrá el estómago vacío? 
—El vacío es más bien en la cabeza.",CXXXVI,136,,,,,,,,,
50339,Antonio Machado,02-Campos de Castilla (1907-1917),,(Proverbios y cantares),LI,,"Luz del alma, luz divina, 
faro, antorcha, estrella, sol . . . 
Un hombre a tientas camina; 
lleva a la espalda un farol.",CXXXVI,136,,,,,,,,,
50340,Antonio Machado,02-Campos de Castilla (1907-1917),,(Proverbios y cantares),LII,,"Discutiendo están dos mozos 
si a la fiesta del lugar 
irán por la carretera 
o campo atraviesa irán. 
Discutiendo y disputando 
empiezan a pelear. 
Ya con las trancas de pino 
furiosos golpes se dan; 
ya se tiran de las barbas, 
que se las quieren pelar. 
Ha pasado un carretero, 
que va cantando un cantar: 
«Romero, para ir a Roma, 
lo que importa es caminar; 
a Roma por todas partes, 
por todas partes se va.»",CXXXVI,136,,,,,,,,,
50341,Antonio Machado,02-Campos de Castilla (1907-1917),,(Proverbios y cantares),LIII,,"Ya hay un español que quiere 
vivir y a vivir empieza, 
entre una España que muere 
y otra España que bosteza. 
Españolito que vienes 
al mundo, te guarde Dios. 
Una de las dos Españas 
ha de helarte el corazón.",CXXXVI,136,,,,,,,,,
50342,Antonio Machado,02-Campos de Castilla (1907-1917),,(Parábolas,I,,"Era un niño que soñaba 
un caballo de cartón. 
Abrió los ojos el niño 
y el caballito no vio. 
Con un caballito blanco 
el niño volvió a soñar; 
y por la crin la cogía . . . 
¡Ahora no te escaparás!
Apenas lo hubo cogido, 
el niño se despertó. 
Tenía el puño cerrado. 
¡El caballito voló! 
Quedóse el niño muy serio 
pensando que no es verdad 
un caballito soñado. 
Y ya no volvió a soñar. 
Pero el niño se hizo mozo
y el mozo tuvo un amor, 
y a su amada le decía: 
¿Tú eres de verdad o no? 
Cuando el mozo se hizo viejo 
pensaba: todo es soñar, 
el caballito soñado 
y el caballo de verdad. 
Y cuando vino la muerte, 
el viejo a su corazón 
preguntaba: ¿Tú eres sueño? 
¡Quién sabe si despertó!",CXXXVII,137,,,,,,,,,
50343,Antonio Machado,02-Campos de Castilla (1907-1917),,(Parábolas,II,A D. Vicente Ciurana.,"Sobre la limpia arena, en el tartesio llano 
por donde acaba España y sigue el mar, 
hay dos hombres que apoyan la cabeza en la mano; 
uno duerme, y el otro parece meditar. 
El uno, en la mañana de tibia primavera, 
junto a la mar tranquila, 
ha puesto entre sus ojos y el mar que reverbera, 
los párpados, que borran el mar en la pupila. 
Y se ha dormido, y sueña con el pastor Proteo, 
que sabe los rebaños del marino guardar; 
y sueña que le llaman las hijas de Nereo, 
y ha oído a los caballos de Poseidón hablar. 
El otro mira al agua. Su pensamiento flota; 
hijo del mar, navega—o se pone a volar. 
Su pensamiento tiene un vuelo de gaviota,
que ha visto un pez de plata en el agua saltar. 
Y piensa: «Es esta vida una ilusión marina 
de un pescador que un día ya no puede pescar.»
El soñador ha visto que el mar se le ilumina, 
y sueña que es la muerte una ilusión del mar.",CXXXVII,137,,,,,,,,,
50344,Antonio Machado,02-Campos de Castilla (1907-1917),,(Parábolas,III,,"Érase de un marinero 
que hizo un jardín junto al mar, 
y se metió a jardinero. 
Estaba el jardín en flor, 
y el jardinero se fue 
por esos mares de Dios.",CXXXVII,137,,,,,,,,,
50345,Antonio Machado,02-Campos de Castilla (1907-1917),,(Parábolas,IV (Consejos),,"Sabe esperar, aguarda que la marea fluya, 
—así en la costa un barco—sin que al partir te inquiete. 
Todo el que aguarda sabe que la victoria es suya; 
porque la vida es larga y el arte es un juguete. 
Y sí la vida es corta 
y no llega la mar a tu galera, 
aguarda sin partir y siempre espera, 
que el arte es largo y, además, no importa.
",CXXXVII,137,,,,,,,,,
50346,Antonio Machado,02-Campos de Castilla (1907-1917),,(Parábolas,V (Profesión de fe),,"Dios no es el mar, está en el mar; riela 
como luna en el agua, o aparece 
como una blanca vela; 
en el mar se despierta o se adormece. 
Creó la mar, y nace 
de la mar cual nube y la tormenta; 
es el Criador y la criatura lo hace; 
su aliento es alma, y por el alma alienta. 
Yo he de hacerte, mi Dios, cual tú me hiciste, 
y para darte el alma que me diste 
en mí te he de crear. Que el puro río 
de caridad que fluye eternamente, 
fluya en mi corazón. ¡Seca, Dios mío, 
de una fe sin amor la turbia fuente!",CXXXVII,137,,,,,,,,,
50347,Antonio Machado,02-Campos de Castilla (1907-1917),,(Parábolas,VI,,"El Dios que todos llevamos, 
el Dios que todos hacemos, 
el Dios que todos buscamos
y que nunca encontraremos. 
Tres dioses o tres personas 
del solo Dios verdadero.",CXXXVII,137,,,,,,,,,
50348,Antonio Machado,02-Campos de Castilla (1907-1917),,(Parábolas,VII,,"Dice la razón: Busquemos 
la verdad! 
Y el corazón: Vanidad. 
La verdad ya la tenemos. 
La razón: ¡Ay, quién alcanza 
la verdad! 
El corazón: Vanidad. 
La verdad es la esperanza. 
Dice la razón: Tú mientes. 
Y contesta el corazón: 
Quien miente eres tú, razón, 
que dices lo que no sientes. 
La razón: Jamás podremos 
entendernos, corazón. 
El corazón: Lo veremos.",CXXXVII,137,,,,,,,,,
50349,Antonio Machado,02-Campos de Castilla (1907-1917),,(Parábolas,VIII,,"Cabeza meditadora, 
¡qué lejos se oye el zumbido 
de la abeja libadora! 

Echaste un velo de sombra 
sobre el bello mundo, y vas 
creyendo ver, porque mides 
la sombra con un compás. 

Mientras la abeja fabrica, 
melifica, 
con jugo de campo y sol, 
yo voy echando verdades 
que nada son, vanidades 
al fondo de mi crisol. 
De la mar al percepto, 
del percepto al concepto,
del concepto a la idea 
—¡oh, la linda tarea!—, 
de la idea a la mar. 
¡Y otra vez a empezar!",CXXXVII,137,,,,,,,,,
50350,Antonio Machado,02-Campos de Castilla (1907-1917),,(Mi bufón),,,"El demonio de mis sueños 
ríe con sus labios rojos, 
sus negros y vivos ojos, 
sus dientes finos, pequeños. 
Y jovial y picaresco 
se lanza a un baile grotesco, 
luciendo el cuerpo deforme 
y su enorme 
joroba. Es feo y barbudo, 
y chiquitín y panzudo. 
Yo no sé por qué razón, 
de mi tragedia, bufón, 
te ríes . . . Mas tú eres vivo 
por tu danzar sin motivo.",CXXXVIII,138,,,,,,,,,
50351,Antonio Machado,02-Campos de Castilla (1907-1917),Elogios,(A don Francisco Giner de los Ríos),,,"Como se fue el maestro, 
la luz de esta mañana 
me dijo: Van tres días 
que mi hermano Francisco no trabaja. 
¿Murió? . . . Sólo sabemos 
que se nos fue por una senda clara, 
diciéndonos: Hacedme 
un duelo de labores y esperanzas. 
Sed buenos y no más, sed lo que he sido 
entre vosotros: alma. 
Vivid, la vida sigue, 
los muertos mueren y las sombras pasan; 
lleva quien deja y vive el que ha vivido. 
¡Yunques, sonad; enmudeced, campanas!

Y hacia otra luz más pura 
partió el hermano de la luz del alba, 
del sol de los talleres, 
el viejo alegre de la vida santa. 
... Oh, sí, llevad, amigos, 
su cuerpo a la montaña, 
a los azules montes 
del ancho Guadarrama. 
Allí hay barrancos hondos 
de pinos verdes donde el viento canta. 
Su corazón repose 
bajo una encina casta, 
en tierra de tomillos, donde juegan 
mariposas doradas . . . 
Allí el maestro un día 
soñaba un nuevo florecer de España.

(Baeza, 21 febrero 1915.)",CXXXIX,139,,,,,,,,,
50352,Antonio Machado,02-Campos de Castilla (1907-1917),Elogios,(Al joven medí tador José Ortega y Gasset),,,"A ti laurel y yedra 
corónente, dilecto 
de Sofía, arquitecto. 
Cincel, martillo y piedra 
y masones te sirvan; las montañas 
de Guadarrama frío 
te brinden el azul de sus entrañas, 
meditador de otro Escorial sombrío. 
Y que Felipe austero, 
al borde de su regia sepultura, 
asome a ver la nueva arquitectura, 
y bendiga la prole de Lutero.",CXL,140,,,,,,,,,
50353,Antonio Machado,02-Campos de Castilla (1907-1917),Elogios,(A Xavier Valcarce),,,"Valcarce, dulce amigo, si tuviera 
la voz que tuve antaño, cantaría
el intermedio de tu primavera 
—porque aprendiz he sido de ruiseñor un día—, 
y el rumor de tu huerto—entre las flores 
el agua oculta corre, pasa y suena 
por acequias, regatos y atanores—, 
y el inquieto bullir de tu colmena, 
y esa doliente juventud que tiene 
ardores de faunalias, 
y que pisando viene 
la huella a mis sandalias. 

Mas hoy . . . ¿será porque el enigma grave 
me tentó en la desierta galería, 
y abrí con una diminuta llave 
el ventanal del fondo que da a la mar sombría? 
¿Será porque se ha ido 
quien asentó mis pasos en la tierra,
y en este nuevo ejido 
sin rubia mies, la soledad me aterra? 

No sé, Valcarce, mas cantar no puedo; 
se ha dormido la voz en mi garganta, 
y tiene el corazón un salmo quedo. 
Ya sólo reza el corazón, no canta. 

Mas hoy, Valcarce, como un fraile viejo 
puedo hacer confesión, que es dar consejo. 
En este día claro, en que descansa 
tu carne de quimeras y amoríos 
—así en amplio silencio se remansa 
el agua bullidora de los ríos—, 
no guardes en tu cofre la galana 
veste dominical, el limpio traje, 
para llenar de lágrimas mañana 
la mustia seda y el marchito encaje,
sino viste, Valcarce, dulce amigo, 
gala de fiesta para andar contigo. 

Y cíñete la espada rutilante, 
y lleva tu armadura,
el peto de diamante 
debajo de la blanca vestidura. 
¡Quién sabe! Acaso tu domingo sea 
la jornada guerrera y laboriosa, 
el día del Señor, que no reposa, 
el claro día en que el Señor pelea.",CXLI,141,,,,,,,,,
50354,Antonio Machado,02-Campos de Castilla (1907-1917),Elogios,(Mariposa de la sierra),,,"¿No eres tú, mariposa, 
el alma de estas sierras solitarias, 
de sus barrancos hondos, 
y de sus cumbres agrias? 
Para que tú nacieras, 
con su varita mágica 
a las tormentas de la piedra, un día, 
mandó callar un hada, 
y encadenó los montes, 
para que tú volaras. 
Anaranjada y negra, 
morenita y dorada, 
mariposa montés, sobre el romero 
plegadas las alillas o, voltarias, 
jugando con el sol, o sobre un rayo 
de sol crucificadas. 
¡Mariposa montés y campesina, 
mariposa serrana,
nadie ha pintado tu color; tú vives 
tu color y tus alas 
en el aire, en el sol, sobre el romero, 
tan libre, tan salada! . . . 
Que Juan Ramón Jiménez 
pulse por ti su lira franciscana. 
 
(Sierra de Cazorla, 28 mayo 1915.)",CXLII,142,,,,,,,,,
