,autor,libro,metaTL,poema,fragmento,destinatario,texto,AA#1-Espasa(1989)-Roman num.,AA#2-Espasa(1989)-Arabian num.,MM#1-Etc.,MM#2-Etc.,,,,,,,
50203,Antonio Machado,02-Campos de Castilla (1907-1917),,(Por tierras de España),,,"El hombre de estos campos que incendia los pinares 
y su despojo aguarda como botín de guerra, 
antaño hubo raído los negros encinares, 
talado los robustos robledos de la sierra. 

Hoy ve sus pobres hijos huyendo de sus lares; 
la tempestad llevarse los limos de la tierra 
por las sagrados ríos hacia los anchos mares; 
y en páramos malditos trabaja, sufre y yerra. 

Es hijo de una estirpe de rudos caminantes, 
pastores que conducen sus hordas de merinos 
a Extremadura fértil, rebaños trashumantes 
que mancha el polvo y dora el sol de los caminos. 

Pequeño, ágil, sufrido, los ojos de hombre astuto, 
hundidos, recelosos, movibles; y trazadas 
cual arco de ballesta, en el semblante enjuto
de pómulos salientes, las cejas muy pobladas. 

Abunda el hombre malo del campo y de la aldea, 
capaz de insanos vicios y crímenes bestiales, 
que bajo el pardo sayo esconde un alma fea, 
esclava de los siete pecados capitales. 

Los ojos siempre turbios de envidia o de tristeza, 
guarda su presa y llora la que el vecino alcanza; 
ni para su infortunio ni goza su riqueza; 
le hieren y acongojan fortuna y malandanza.

El numen de estos campos es sanguinario y fiero; 
al declinar la tarde, sobre el remoto alcor, 
veréis agigantarse la forma de un arquero, 
la forma de un inmenso centauro flechador. 

Veréis llanuras bélicas y páramos de asceta 
—no fue por estos campos el bíblico jardín—; 
son tierras para el águila, un trozo de planeta
por donde cruza errante la sombra de Caín.",XCIX,99,,,,,,,,,
50204,Antonio Machado,02-Campos de Castilla (1907-1917),,(El hospicio),,,"Es el hospicio, el viejo hospicio provinciano, 
el caserón ruinoso de ennegrecidas tejas 
en donde los vencejos anidan en verano 
y graznan en las noches de invierno las cornejas. 

Con sü frontón al Norte, entre los dos torreones 
de antigua fortaleza, el sórdido edificio 
de grietados muros y sucios paredones, 
es un rincón de sombra eterna. ¡El viejo hospicio! 

Mientras el sol de enero su débil luz envía, 
su triste luz velada sobre los campos yermos, 
a un ventanuco asoman, al declinar el día, 
algunos rostros pálidos, atónitos y enfermos, 

a contemplar los montes azules de la sierra; 
o, de los cielos blancos, como sobre una fosa, 
caer la blanca nieve sobre la fría tierra,
¡sobre la tierra fría la nieve silenciosa! . . .",C,100,,,,,,,,,
50205,Antonio Machado,02-Campos de Castilla (1907-1917),,(El Dios ibero),,,"Igual que el ballestero 
tahúr de la cantiga, 
tuviera una saeta el hombre ibero 
para el Señor que apedreó la espiga 
y malogró los frutos otoñales,
y un «gloria a ti» para el Señor que grana 
centenos y trigales 
que el pan bendito le darán mañana. 

«Señor de la ruina, 
adoro porque aguardo y porque temo: 
con mi oración se inclina 
hacia la tierra un corazón blasfemo. 

¡Señor, por quien arranco el pan con pena, 
sé tu poder, conozco mi cadena! 
¡Oh dueño de la nube del estío
que la campiña arrasa, 
del seco otoño, del helar tardío, 
y del bochorno que la mies abrasa! 

¡Señor del iris, sobre el campo verde 
donde la oveja pace, 
Señor del fruto que el gusano muerde 
y de la choza que el turbión deshace, 

tu soplo el fuego del hogar aviva, 
tu lumbre da sazón al rubio grano, 
y cuaja el hueso de la verde oliva, 
la noche de San Juan, tu santa mano! 

¡Oh dueño de fortuna y de pobreza, 
ventura y malandanza, 
que al rico das favores y pereza 
y al pobre su fatiga y su esperanza! 

¡Señor, Señor: en la voltaria rueda
del año he visto mi simiente echada, 
corriendo igual albur que la moneda 
del jugador en el azar sembrada! 

¡Señor, hoy paternal, ayer cruento, 
con doble faz de amor y de venganza, 
a ti, en un dado de tahur al viento 
va mi oración, blasfemia y alabanza!» 
Este que insulta a Dios en los altares, 
no más atento al ceño del destino, 
también soñó caminos en los mares 
y dijo: es Dios sobre la mar camino.

¿No es él quien puso a Dios sobre la guerra, 
más allá de la suerte, 
más allá de la tierra, 
más allá de la mar y de la muerte? 

¿No dio la encina ibera 
para el fuego de Dios la buena rama, 
que fue en la santa hoguera 
de amor una con Dios en pura llama? 

Mas hoy . . . ¡Qué importa un día! 
Para los nuevos lares 
estepas hay en la floresta umbría, 
leña verde en los viejos encinares. 

Aún larga patria espera 
abrir al corvo arado sus besanas; 
para el grano de Dios hay sementera 
bajo cardos y abrojos y bardanas.

¡Qué importa un día! Está el ayer alerto 
al mañana, mañana al infinito, 
hombres de España, ni el pasado ha muerto, 
ni está el mañana—ni el ayer—escrito. 

¿Quién ha visto la faz al Dios hispano? 
Mi corazón aguarda 
al hombre ibero de la recia mano, 
que tallará en el roble castellano 
el Dios adusto de la tierra parda.",CI,101,,,,,,,,,
50206,Antonio Machado,02-Campos de Castilla (1907-1917),,(Orillas del Duero),,,"¡Primavera soriana, primavera 
humilde, como el sueño de un bendito, 
de un pobre caminante que durmiera 
de cansancio en un páramo infinito! 

¡Campillo amarillento, 
como tosco sayal de campesina, 
pradera de velludo polvoriento 
donde pace la escuálida merina!

¡Aquellos diminutos pegujales 
de tierra dura y fría, 
donde apuntan centenos y trigales 
que el pan moreno nos darán un día! 

Y otra vez roca y roca, pedregales 
desnudos y pelados serrijones, 
la tierra de las águilas caudales,
malezas y jarales, 
hierbas monteses, zarzas y cambrones. 

¡Oh tierra ingrata y fuerte, tierra mía! 
¡Castilla, tus decrépitas ciudades! 
¡La agria melancolía 
que puebla tus sombrías soledades! 

¡Castilla veronil, adusta tierra, 
Castilla del desdén contra la suerte, 
Castilla del dolor y de la guerra, 
tierra inmortal, Castilla de la muerte! 

Era una tarde, cuando el campo huía 
del sol, y en el asombro del planeta, 
como un globo morado aparecía 
la hermosa luna, amada del poeta. 

En el cárdeno cielo vïoleta 
alguna clara estrella fulguraba.
El aire ensombrecido 
oreaba mis sienes, y acercaba 
el murmullo del agua hasta mi oído. 

Entre cerros de plomo y de ceniza 
manchados de roídos encinares, 
y entre calvas roquedas de caliza, 
iba a embestir los ocho tajamares 
del puente el padre río, 
que surca de Castilla el yermo frío.

¡Oh Duero, tu agua corre
y correrá mientras las nieves blancas
de enero el sol de mayo
haga fluir por hoces y barrancas,
mientras tengan las sierras su turbante 
de nieve y de tormenta 
y brille el olifante 
del sol, tras de la nube cenicienta!... 

¿Y el viejo romancero
fue el sueño de un juglar junto a tu orilla? 
¿Acaso como tú y por siempre, Duero, 
irá corriendo hacia la mar Castilla? ",CII,102,,,,,,,,,
50207,Antonio Machado,02-Campos de Castilla (1907-1917),,(Las encinas),,,"¡Encinares castellanos 
en laderas y altozanos, 
serrijones y colinas 
llenos de obscura maleza, 
encinas, pardas encinas; 
humildad y fortaleza! 

Mientras que llenándoos va 
el hacha de calvijares, 
¿nadie cantaros sabrá, 
encinares? 

El roble es la guerra, el roble 
dice el valor y el coraje, 
rabia inmoble 
en su torcido ramaje;
y es más rudo 
que la encina, más nervudo, 
más altivo y más señor. 

El alto roble parece 
que recalca y ennudece 
su robustez como atleta 
que, erguido, afinca en el suelo. 

El pino es el mar y el cielo 
y la montaña: el planeta. 
La palmera es el desierto, 
el sol y la lejanía:
la sed; una fuente fría 
soñada en el campo yerto. 

Las hayas son la leyenda. 
Alguien, en las viejas hayas, 
leía una historia horrenda
de crímenes y batallas. 

¿Quién ha visto sin temblar 
un hayedo en un pinar? 
Los chopos son la ribera, 
liras de la primavera, 
cerca del agua que fluye, 
pasa y huye, 
viva o lenta, 
que se emboca turbulenta 
o en remanso se dilata. 
En su eterno escalofrío 
copian del agua del río 
las vivas ondas de plata. 

De los parques las olmedas 
son las buenas arboledas 
que nos han visto jugar, 
cuando eran nuestros cabellos
rubios y, con nieve en ellos, 
nos han de ver meditar. 

Tiene el manzano el olor 
de su poma, 
el eucalipto el aroma 
de sus hojas, de su flor 
el naranjo la fragancia; 
y es del huerto 
la elegancia 
el ciprés obscuro y yerto. 

¿Qué tienes tú, negra encina 
campesina, 
con tus ramas sin color 
en el campo sin verdor; 
con tu tronco ceniciento 
sin esbeltez ni altiveza,
con tu vigor sin tormento, 
y tu humildad que es firmeza? 

En tu copa ancha y redonda 
nada brilla, 
ni tu verdiobscura fronda 
ni tu flor verdiamarilla. 

Nada es lindo ni arrogante 
en tu porte, ni guerrero, 
nada fiero 
que aderece su talante. 
Brotas derecha o torcida 
con esa humildad que cede 
sólo a la ley de la vida, 
que es vivir como se puede.

El campo mismo se hizo 
árbol en ti, parda encina. 
Ya bajo el sol que calcina, 
ya contra el hielo invernizo, 
el bochorno y la borrasca, 
el agosto y el enero, 
los copos de la nevasca, 
los hilos del aguacero, 
siempre fírme, siempre igual, 
impasible, casta y buena, 
¡oh tú, robusta y serena, 
eterna encina rural 
de los negros encinares 
de la raya aragonesa 
y las crestas militares 
de la tierra pamplonesa; 
encinas de Extremadura, 
de Castilla, que hizo a España,
encinas de la llanura, 
del cerro y de la montaña; 
encinas del alto llano 
que el joven Duero rodea, 
y del Tajo que serpea 
por el suelo toledano; 
encinas de junto al mar
—en Santander—, encinar 
que pones tu nota arisca, 
como un castellano ceño, 
en Córdoba la morisca, 
y tú, encinar madrileño, 
bajo Guadarrama frío, 
tan hermoso, tan sombrío,
con tu adustez castellana 
corrigiendo, 
la vanidad y el atuendo 
y la hetiquez cortesana! . . . 
Ya sé, encinas 
campesinas, 
que os pintaron, con lebreles 
elegantes y corceles, 
los más egregios pinceles, 
y os cantaron los poetas 
augustales, 
que os asordan escopetas 
de cazadores reales; 
mas sois el campo y el lar 
y la sombra tutelar 
de los buenos aldeanos 
que visten parda estameña, 
y que cortan vuestra leña
con sus manos.",CIII,103,,,,,,,,,
50208,Antonio Machado,02-Campos de Castilla (1907-1917),,"¿Eres tú, Guadarrama, viejo amigo",,,"¿Eres tú, Guadarrama, viejo amigo, 
la sierra gris y blanca, 
la sierra de mis tardes madrileñas 
que yo veía en el azul pintada? 

Por tus barrancos hondos 
y por tus cumbres agrias, 
mil Guadarramas y mil soles vienen, 
cabalgando conmigo, a tus entrañas. 
",CIV,104,"(Camino de Balsaín, 1911.)",,,,,,,,
50209,Antonio Machado,02-Campos de Castilla (1907-1917),,"(En abril, las aguas mil)",,,"Son de abril las aguas mil. 
Sopla el viento achubascado, 
y entre nublado y nublado 
hay trozos de cielo añil. 

Agua y sol. El iris brilla. 
En una nube lejana, 
zigzaguea 
una centella amarilla. 

La lluvia da en la ventana 
y el cristal repiquetea. 

A través de la neblina 
que forma la lluvia fina, 
se divisa un prado verde, 
y un encinar se esfumina, 
y una sierra gris se pierde.

Los hilos del aguacero 
sesgan las nacientes frondas, 
y agitan las turbias ondas 
en el remanso del Duero. 

Lloviendo está en los habares 
y en las pardas sementeras; 
hay sol en los encinares, 
charcos por las carreteras. 

Lluvia y sol. Ya se obscurece 
el campo, ya se ilumina; 
allí un cerro desparece, 
allá surge una colina. 

Ya son claros, ya sombríos 
los dispersos caseríos, 
los lejanos torreones. 

Hacia la sierra plomiza
van rodando en pelotones 
nubes de guata y ceniza.",CV,105,,,,,,,,,
50210,Antonio Machado,02-Campos de Castilla (1907-1917),,(Un loco),,,"Es una tarde mustia y desabrida 
de un otoño sin frutos, en la tierra 
estéril y raída 
donde la sombra de un centauro yerra. 

Por un camino en la árida llanura, 
entre álamos marchitos, 
a solas con su sombra y su locura
va el loco, hablando a gritos. 

Lejos se ven sombríos estepares, 
colinas con malezas y cambrones, 
y ruinas de viejos encinares, 
coronando los agrios serrijones. 

El loco vocifera 
a solas con su sombra y su quimera. 
Es horrible y grotesca su figura;
flaco, sucio, maltrecho y mal rapado, 
ojos de calentura 
iluminan su rostro demacrado. 

Huye de la ciudad . . . Pobres maldades, 
misérrimas virtudes y quehaceres 
de chulos aburridos, y ruindades 
de ociosos mercaderes. 

Por los campos de Dios el loco avanza. 
Tras la tierra esquelética y sequiza 
—rojo de herrumbe y pardo de ceniza— 
hay un sueño de lirio en lontananza. 

Huye de la ciudad. ¡El tedio urbano! 
—¡Carne triste y espíritu villano!—

No fue por una trágica amargura 
esta alma errante desgajada y rota; 
purga un pecado ajeno: la cordura,
la terrible cordura del idiota.",CVI,106,,,,,,,,,
50211,Antonio Machado,02-Campos de Castilla (1907-1917),,(Fantasía iconográfica),,,"La calva prematura 
brilla sobre la frente amplia y severa; 
bajo la piel de pálida tersura 
se trasluce la fina calavera. 

Mentón agudo y pómulos marcados 
por trazos de un punzón adamantino; 
y de insólita púrpura manchados 
los labios que soñara un florentino. 

Mientras la boca sonreír parece, 
los ojos perspicaces, 
que un ceño pensativo empequeñece, 
miran y ven, profundos y tenaces. 

Tiene sobre la mesa un libro viejo 
donde posa la mano distraída. 
Al fondo de la cuadra, en el espejo,
una tarde dorada está dormida. 

Montañas de violeta 
y grisientos breñales, 
la tierra que ama el santo y el poeta, 
los buitres y las águilas caudales. 

Del abierto balcón al blanco muro 
va una franja de sol anaranjada 
que inflama el aire, en el ambiente obscuro 
que envuelve la armadura arrinconada.",CVII,107,,,,,,,,,
50212,Antonio Machado,02-Campos de Castilla (1907-1917),,(Un criminal),,,"El acusado es pálido y lampiño. 
Arde en sus ojos una fosca lumbre, 
que repugna a su máscara de niño 
y ademán de piadosa mansedumbre. 

Conserva del obscuro seminario 
el talante modesto y la costumbre 
de mirar a la tierra o al breviario.

Devoto de María, 
madre de pecadores, 
por Burgos bachiller en teología, 
presto a tomar las órdenes menores. 

Fue su crimen atroz. Hartóse un día 
de los textos profanos y divinos, 
sintió pesar del tiempo que perdía 
enderezando hipérbatons latinos.

Enamoróse de una hermosa niña; 
subiósele el amor a la cabeza 
como el zumo dorado de la viña, 
y despertó su natural fiereza. 

En sueños vio a sus padres—labradores 
de mediano caudal—iluminados, 
del hogar por los rojos resplandores, 
los campesinos rostros atezados. 

Quiso heredar. ¡Oh, guindos y nogales 
del huerto familiar, verde y sombrío, 
y doradas espigas candeales 
que colmarán los trojes del estío! 

Y se acordó del hacha que pendía 
en el muro, luciente y afilada, 
el hacha fuerte que la leña hacía 
de la rama de roble cercenada.
.....................................................................

Frente al reo, los jueces con sus viejos 
ropones enlutados; 
y una hilera de obscuros entrecejos 
y de plebeyos rostros: los jurados. 

El abogado defensor perora, 
golpeando el pupitre con la mano; 
emborrona papel un escribano, 
mientras oye el fiscal, indiferente, 
el alegato enfático y sonoro, 
y repasa los autos judiciales 
o, entre sus dedos, de las gafas de oro 
acaricia los límpidos cristales.

Dice un ujier: «Va sin remedio al palo». 
El joven cuervo la clemencia espera. 
Un pueblo, carne de horca, la severa 
justicia aguarda que castiga al malo.",CVIII,108,,,,,,,,,
50213,Antonio Machado,02-Campos de Castilla (1907-1917),,(Amanecer de otoño),,,"Una larga carretera 
entre grises peñascales, 
y alguna humilde pradera 
donde pacen negros toros. Zarzas, malezas, jarales. 

Está la tierra mojada 
por las gotas del rocío, 
y la alameda dorada, 
hacia la curva del río. 

Tras los montes de violeta 
quebrado el primer albor; 
a la espalda la escopeta, 
entre sus galgos agudos, caminando un cazador.",CIX,109,,,,,,,,,
50214,Antonio Machado,02-Campos de Castilla (1907-1917),,(En tren),,,"Yo, para todo viaje 
—siempre sobre la madera 
de mi vagón de tercera—, 
voy ligero de equipaje. 
Si es de noche, porque no 
acostumbro a dormir yo, 
y de día, por mirar 
los arbolitos pasar, 
yo nunca duermo en el tren, 
y, sin embargo, voy bien. 
¡Este placer de alejarse! 
Londres, Madrid, Ponferrada, 
tan lindos . . . para marcharse. 
Lo molesto es la llegada.
Luego, el tren, al caminar, 
siempre nos hace soñar; 
y casi, casi olvidamos
el jamelgo que montamos. 
¡Oh, el pollino 
que sabe bien el camino! 
¿Dónde estamos? 
¿Dónde todos nos bajamos? 
¡Frente a mí va una monjita 
tan bonita! 
Tiene esa expresión serena 
que a la pena 
da una esperanza infinita. 
Y yo pienso: Tú eres buena; 
porque diste tus amores 
a Jesús; porque jio quieres 
ser madre de pecadores. 
Mas tú eres 
maternal, 
bendita entre las mujeres, 
madrecita virginal.
Algo en tu rostro es divino
bajo tus cofias de lino.
Tus mejillas
—esas rosas amarillas—
fueron rosadas, y, luego,
ardió en tus entrañas fuego;
y hoy, esposa de la Cruz,
ya eres luz, y sólo luz...
¡Todas las mujeres bellas
fueran, como tú, doncellas
en un convento a encerrarse!...
Y la niña que yo quiero,
¡ay! ¡preferirá casarse
con un mocito barbero!
El tren camina y camina,
y la máquina resuella,
y tose con tos ferina.
¡Vamos en una centella!
",CX,110,,,,,,,,,
50215,Antonio Machado,02-Campos de Castilla (1907-1917),,(Noche de verano),,,"Es una hermosa noche de verano. 
Tienen las altas casas 
abiertos los balcones 
del viejo pueblo a la anchurosa plaza. 
En el amplio rectángulo desierto, 
bancos de piedra, evónimos y acacias 
simétricos dibujan 
sus negras sombras en la arena blanca. 
En el cenit, la luna, y en la torre, 
la esfera del reloj iluminada. 
Yo en este viejo pueblo paseando 
solo, como un fantasma.

",CXI,111,,,,,,,,,
50216,Antonio Machado,02-Campos de Castilla (1907-1917),,(Pascua de Resurrección),,,"Mirad: el arco de la vida traza 
el iris sobre el campo que verdea. 
Buscad vuestros amores, doncellitas, 
done brota la fuente de la piedra. 
En donde el agua ríe y sueña y pasa, 
allí el romance del amor se cuenta. 
¿No han de mirar un día, en vuestros brazos, 
atónitos, el sol de primavera, 
ojos que vienen a la luz cerrados, 
y que al partirse de la vida ciegan? 
¿No beberán un día en vuestros senos 
los que mañana labrarán la tierra? 
¡Oh, celebrad este domingo claro, 
madrecitas en flor, vuestras entrañas nuevas! 
Gozad esta sonrisa de vuestra ruda madre. 
Ya sus hermosos hidos habitan las cigüeñas, 
y escriben en las torres sus blancos garabatos.
Como esmeraldas lucen los musgos de las peñas. 
Entre los robles muerden 
los negros toros la menuda hierba, 
y el pastor que apacienta los merinos 
su pardo sayo en la montaña deja.",CXII,112,,,,,,,,,
50217,Antonio Machado,02-Campos de Castilla (1907-1917),,(Campos de Soria),I,,"Es la tierra de Soria árida y fría. 
Por las colinas y las sierras calvas, 
verdes pradillos, cerros cenicientos, 
la primavera pasa 
dejando entre las hierbas olorosas 
sus diminutas margaritas blancas. 

La tierra no revive, el campo sueña. 
Al empezar abril está nevada 
la espalda del Moncayo; 
el caminante lleva en su bufanda 
envueltos cuello y boca, y los pastores 
pasan cubiertos con sus luengas capas.
",CXIII,113,,,,,,,,,
50218,Antonio Machado,02-Campos de Castilla (1907-1917),,(Campos de Soria),II,,"Las tierras labrantías, 
como retazos de estameñas pardas, 
el huertecillo, el abejar, los trozos 
de verde obscuro en que el merino pasta, 
entre plomizos peñascales, siembran 
el sueño alegre de infantil Arcadia. 
En los chopos lejanos del camino, 
parecen humear las yertas ramas 
como un glauco vapor—las nuevas hojas— 
y en las quiebras de valles y barrancas 
blanquean los zarzales florecidos, 
y brotan las violetas perfumadas.",CXIII,113,,,,,,,,,
50219,Antonio Machado,02-Campos de Castilla (1907-1917),,(Campos de Soria),III,,"Es el campo undulado, y los caminos 
ya ocultan los viajeros que cabalgan 
en pardos borriquillos, 
ya al fondo de la tarde arrebolada 
elevan las plebeyas figurillas, 
que el lienzo de oro del ocaso manchan. 
Mas si trepáis a un cerro y veis el campo 
desde los picos donde habita el águila, 
son tornasoles de carmín y acero,
llanos plomizos, lomas plateadas, 
circuidos por montes de violeta, 
con las cumbres de nieve sonrosada.",CXIII,113,,,,,,,,,
50220,Antonio Machado,02-Campos de Castilla (1907-1917),,(Campos de Soria),IV,,"¡Las figuras del campo sobre el cielo! 
Dos lentos bueyes aran 
en un alcor, cuando el otoño empieza, 
y entre las negras testas doblegadas 
bajo el pesado yugo, 
pende un cesto de juncos y retama, 
que es la cuna de un niño; 
y tras la yunta marcha 
un hombre que se inclina hacia la tierra, 
y una mujer que en las abiertas zanjas 
arroja la semilla. 
Bajo una nube de carmín y llama, 
en el oro fluido y verdinoso 
del poniente, las sombras se agigantan.",CXIII,113,,,,,,,,,
50221,Antonio Machado,02-Campos de Castilla (1907-1917),,(Campos de Soria),V,,"La nieve. En el mesón al campo abierto 
se ve el hogar donde la leña humea 
y la olla al hervir borbollonea. 
El cierzo corre por el campo yerto, 
alborotando en blancos torbellinos 
la nieve silenciosa. 
La nieve sobre el campo y los caminos, 
cayendo está como sobre una fosa. 
Un viejo acurrucado tiembla y tose 
cerca del fuego; su mechón de lana 
la vieja hila, y una niña cose 
verde ribete a su estameña grana. 
Padres los viejos son de un arriero 
que caminó sobre la blanca tierra, 
y una noche perdió ruta y sendero, 
y se enterró en las nieves de la sierra. 
En torno al fuego hay un lugar vacío,
y en la frente del viejo, de hosco ceño, 
como un tachón sombrío 
—tal el golpe de un hacha sobre un leño—.
La vieja mira al campo, cual si oyera 
pasos sobre la nieve. Nadie pasa. 
Desierta la vecina carretera, 
desierto el campo en torno de la casa. 
La niña piensa que en los verdes prados 
ha de correr con otras doncellitas 
en los días azules y dorados, 
cuando crecen las blancas margaritas.",CXIII,113,,,,,,,,,
50222,Antonio Machado,02-Campos de Castilla (1907-1917),,(Campos de Soria),VI,,"¡Soria fría, Soria pura, 
cabeza de Extremadura, 
con su castillo guerrero 
arruinado, sobre el Duero; 
con sus murallas roídas 
y sus casas denegridas! 

¡Muerta ciudad de señores 
soldados o cazadores; 
de portales con escudos 
de cien linajes hidalgos, 
y de famélicos galgos, 
de galgos flacos y agudos, 
que pululan 
por las sórdidas callejas, 
y a la media noche ululan, 
cuando graznan las cornejas!

¡Soria fría! La campana 
de la Audiencia da la una. 
Soria, ciudad castellana 
¡tan bella! bajo la luna.",CXIII,113,,,,,,,,,
50223,Antonio Machado,02-Campos de Castilla (1907-1917),,(Campos de Soria),VII,,"¡Colinas plateadas, 
grises alcores, cárdenas roquedas 
por donde traza el Duero 
su curva de ballesta 
en torno a Soria, obscuros encinares, 
ariscos pedregales, calvas sierras, 
caminos blancos y álamos del río, 
tardes de Soria, mística y guerrera,
hoy siento por vosotros, en el fondo 
del corazón, tristeza, 
tristeza que es amor! ¡Campos de Soria 
donde parece que las rocas sueñan, 
conmigo vais! ¡Colinas plateadas, 
grises alcores, cárdenas roquedas! . . .",CXIII,113,,,,,,,,,
50224,Antonio Machado,02-Campos de Castilla (1907-1917),,(Campos de Soria),VIII,,"He vuelto a ver los álamos dorados, 
álamos del camino en la ribera 
del Duero, entre San Polo y San Saturio, 
tras las murallas viejas 
de Soria—barbacana 
hacia Aragón, en castellana tierra. 

Estos chopos del río, que acompañan 
con el sonido de sus hojas secas 
el son del agua, cuando el viento sopla, 
tienen en sus cortezas 
grabadas iniciales que son nombres 
de enamorados, cifras que son fechas. 
¡Álamos del amor que ayer tuvisteis 
de ruiseñores vuestras ramas llenas; 
álamos que seréis mañana liras 
del viento perfumado en primavera;
álamos del amor cerca del agua 
que corre y pasa y sueña, 
álamos de las márgenes del Duero, 
conmigo vais, mi corazón os lleva!",CXIII,113,,,,,,,,,
50225,Antonio Machado,02-Campos de Castilla (1907-1917),,(Campos de Soria),IX,,"¡Oh, sí, conmigo vais, campos de Soria, 
tardes tranquilas, montes de violeta, 
alamedas del río, verde sueño 
del suelo gris y de la parda tierra, 
agria melancolía 
de la ciudad decrépita, 
me habéis llegado al alma, 
¿o acaso estabais en el fondo de ella? 
¡Gentes del alto llano numantino 
que a Dios guardáis como cristianas viejas,
que el sol de España os llene 
de alegría, de luz y de riqueza!",CXIII,113,,,,,,,,,
50226,Antonio Machado,02-Campos de Castilla (1907-1917),,(La tierra de Alvargonzález),I,Al poeta Juan Ramón Jiménez,"Siendo mozo Alvargonzález, 
dueño de mediana hacienda, 
que en otras tierras se dice 
bienestar y aquí, opulencia, 
en la feria de Berlanga 
prendóse de una doncella, 
y la tomó por mujer 
al año de conocerla. 
Muy ricas las bodas fueron, 
y quien las vio las recuerda; 
sonadas las tornabodas 
que hizo Alvar en su aldea; 
hubo gaitas, tamboriles, 
flauta, bandurria y vihuela, 
fuegos a la valenciana 
y danza a la aragonesa.
",CXIV,114,,,,,,,,,
50227,Antonio Machado,02-Campos de Castilla (1907-1917),,(La tierra de Alvargonzález),II,,"Feliz vivió Alvargonzález 
en el amor de su tierra. 
Naciéronle tres varones, 
que en el campo son riqueza, 
y, ya crecidos, los puso, 
uno a cultivar la huerta, 
otro a cuidar los merinos, 
y dio el menor a la Iglesia.",CXIV,114,,,,,,,,,
