,autor,libro,metaTL,poema,fragmento,destinatario,texto,AA#1-Espasa(1989)-Roman num.,AA#2-Espasa(1989)-Arabian num.,MM#1-Etc.,MM#2-Etc.,,,,,,,
50426,Antonio Machado,03-Nuevas canciones (1917-1930),,(Galerías),III,,"Una centella blanca
en la nube de plomo culebrea.
¡Los asombrados ojos
del niño, y juntas cejas
-está el salón obscuro- de la madre!...
¡Oh cerrado balcón a la tormenta!
El viento aborrascado y el granizo
en el limpio cristal repiquetean.",CLVI,156,,,,,,,,,
50427,Antonio Machado,03-Nuevas canciones (1917-1930),,(Galerías),IV,,"El iris y el balcón.

Las siete cuerdas
de la lira del sol vibran en sueños.
Un tímpano infantil da siete golpes
—agua y cristal.

Acacias con jilgueros.
Cigüeñas en las torres.

En la plaza,
lavó la lluvia el mirto polvoriento.
En el amplio rectángulo ¿quién puso
ese grupo de vírgenes risueño,
y arriba ¡hosanna! entre la rota nube,
la palma de oro y el azul sereno?",CLVI,156,,,,,,,,,
50428,Antonio Machado,03-Nuevas canciones (1917-1930),,(Galerías),V,,"Entre montes de almagre y peñas grises,
el tren devora su rail de acero.
La hilera de brillantes ventanillas
lleva un doble perfil de camafeo,
tras el cristal de plata, repetido...
¿Quién ha punzado el corazón del tiempo?",CLVI,156,,,,,,,,,
50429,Antonio Machado,03-Nuevas canciones (1917-1930),,(Galerías),VI,,"¿Quién puso, entre las rocas de ceniza,
para la miel del sueño,
esas retamas de oro
y esas azules flores del romero?
La sierra de violeta
y, en el poniente, el azafrán del cielo,
¿quién ha pintado? ¡El abejar, la ermita,
el tajo sobre el río, el sempiterno
rodar del agua entre las hondas peñas,
y el rubio verde de los campos nuevos,
y todo, hasta la tierra blanca y rosa
al pie de los almendros!",CLVI,156,,,,,,,,,
50430,Antonio Machado,03-Nuevas canciones (1917-1930),,(Galerías),VII,,"En el silencio sigue
la lira pitagórica vibrando,
el iris en la luz, la luz que llena
mi estereoscopio vano.
Han cegado mis ojos las cenizas
del fuego heraclitano.
El mundo es, un momento,
transparente, vacío, ciego, alalo.",CLVI,156,,,,,,,,,
50431,Antonio Machado,03-Nuevas canciones (1917-1930),,"(La luna, la sombra y el bufón)",I,,"Fuera, la luna platea
cúpulas, torres, tejados;
dentro, mi sombra pasea
por los muros encalados.
Con esta luna parece
que hasta la sombra envejece.

Ahorremos la serenata
de una cenestesia ingrata,
y una vejez intranquila,
y una luna de hojalata.
Cierra tu balcón, Lucila.",CLVII,157,,,,,,,,,
50432,Antonio Machado,03-Nuevas canciones (1917-1930),,"(La luna, la sombra y el bufón)",II,,"Se pintan panza y joroba
en la pared de mi alcoba.
Canta el bufón:

¡Qué bien van
en un rostro de cartón,
unas barbas de azafrán!
Lucila, cierra el balcón.",CLVII,157,,,,,,,,,
50433,Antonio Machado,03-Nuevas canciones (1917-1930),,(Canciones de tierras altas),I,,"Por la sierra blanca...
La nieve menuda
y el viento de cara.

Por entre los pinos...
Con la blanca nieve
se borra el camino.

Recio viento sopla
de Urbión a Moncayo.
¡Páramos de Soria!",CLVIII,158,,,,,,,,,
50434,Antonio Machado,03-Nuevas canciones (1917-1930),,(Canciones de tierras altas),II,,"Ya habrá cigüeñas al sol,
mirando la tarde roja,
entre Moncayo y Urbión.",CLVIII,158,,,,,,,,,
50435,Antonio Machado,03-Nuevas canciones (1917-1930),,(Canciones de tierras altas),III,,"Se abrió la puerta que tiene
gonces en mi corazón,
y otra vez la galería
de mi historia apareció.

Otra vez la plazoleta
de las acacias en flor,
y otra vez la fuente clara
cuenta un romance de amor.",CLVIII,158,,,,,,,,,
50436,Antonio Machado,03-Nuevas canciones (1917-1930),,(Canciones de tierras altas),IV,,"Es la parda encina
y el yermo de piedra.
Cuando el sol tramonta,
el río despierta.

¡Oh montes lejanos
de malva y violeta!
En el aire en sombra
sólo el río suena.

¡Luna amoratada
de una tarde vieja,
en un campo frío,
más luna que tierra!",CLVIII,158,,,,,,,,,
50437,Antonio Machado,03-Nuevas canciones (1917-1930),,(Canciones de tierras altas),V,,"Soria de montes azules
y de yermos de violeta,
¡cuántas veces te he soñado
en esta florida vega
por donde se va,
entre naranjos de oro,
Guadalquivir a la mar.",CLVIII,158,,,,,,,,,
50438,Antonio Machado,03-Nuevas canciones (1917-1930),,(Canciones de tierras altas),VI,,"¡Cuántas veces me borraste,
tierra de ceniza,
estos limonares verdes
con sombras de tus encinas!

¡Oh, campos de Dios,
entre Urbión el de Castilla
y Moncayo el de Aragón!",CLVIII,158,,,,,,,,,
50439,Antonio Machado,03-Nuevas canciones (1917-1930),,(Canciones de tierras altas),VII,,"En Córdoba, la serrana,
en Sevilla, marinera
y labradora, que tiene
hinchada, hacia el mar, la vela;
y en el ancho llano
por donde la arena sorbe
la baba del mar amargo,
hacia la fuente del Duero
mi corazón ¡Soria pura!
se tornaba... ¡Oh, fronteriza
entre la tierra y la luna!

¡Alta paramera
donde corre el Duero niño,
tierra donde está su tierra!",CLVIII,158,,,,,,,,,
50440,Antonio Machado,03-Nuevas canciones (1917-1930),,(Canciones de tierras altas),VIII,,"El río despierta.
En el aire oscuro,
sólo el río suena.

¡Oh, canción amarga
del agua en la piedra!
... Hacia el alto Espino,
bajo las estrellas.

Sólo suena el río
al fondo del valle,
bajo el alto Espino.",CLVIII,158,,,,,,,,,
50441,Antonio Machado,03-Nuevas canciones (1917-1930),,(Canciones de tierras altas),IX,,"En medio del campo,
tiene la ventana abierta
la ermita sin ermitaño.

Un tejadillo verdoso.
Cuatro muros blancos.

Lejos relumbra la piedra
del áspero Guadarrama.
Agua que brilla y no suena.

En el aire claro,
¡los alamillos del soto,
sin hojas, liras de marzo!",CLVIII,158,,,,,,,,,
50442,Antonio Machado,03-Nuevas canciones (1917-1930),,(Canciones de tierras altas),X. Iris de la noche,A don Ramón del Valle-Inclán,"Hacia Madrid, una noche,
va el tren por el Guadarrama.
En el cielo, el arco iris
que hacen la luna y el agua.
¡Oh, luna de abril serena,
que empuja las nubes blancas!

La madre lleva a su niño,
dormido, sobre la falda.
Duerme el niño y, todavía,
ve el campo verde que pasa,
y arbolillos soleados,
y mariposas doradas.

La madre, ceño sombrío
entre un ayer y un mañana,
ve unas ascuas mortecinas
y una hornilla con arañas.

Hay un trágico viajero,
que debe ver cosas raras,
y habla solo y, cuando mira,
nos borra con la mirada.

Yo pienso en campos de nieve
y en pinos de otras montañas.

Y tú, señor, por quien todos
vemos y que ves las almas,
dinos si todos, un día,
hemos de verte la cara.",CLVIII,158,,,,,,,,,
50443,Antonio Machado,03-Nuevas canciones (1917-1930),,(Canciones),I,,"Junto a la sierra florida,
bulle el ancho mar.
El panal de mis abejas
tiene granitos de sal.",CLIX,159,,,,,,,,,
50444,Antonio Machado,03-Nuevas canciones (1917-1930),,(Canciones),II,,"Junto al agua negra.
Olor de mar y jazmines.
Noche malagueña.",CLIX,159,,,,,,,,,
50445,Antonio Machado,03-Nuevas canciones (1917-1930),,(Canciones),III,,"La primavera ha venido.
Nadie sabe cómo ha sido.",CLIX,159,,,,,,,,,
50446,Antonio Machado,03-Nuevas canciones (1917-1930),,(Canciones),IV,,"La primavera ha venido.
¡Aleluyas blancas
de los zarzales floridos!",CLIX,159,,,,,,,,,
50447,Antonio Machado,03-Nuevas canciones (1917-1930),,(Canciones),V,,"¡Luna llena, luna llena,
tan oronda, tan redonda
en esta noche serena
de marzo, panal de luz
que labran blancas abejas!",CLIX,159,,,,,,,,,
50448,Antonio Machado,03-Nuevas canciones (1917-1930),,(Canciones),VI,,"Noche castellana,
la canción se dice,
o, mejor, se calla.
Cuando duerman todos,
saldré a la ventana.",CLIX,159,,,,,,,,,
50449,Antonio Machado,03-Nuevas canciones (1917-1930),,(Canciones),VII,,"Canta, canta en claro rimo,
el almendro en verde rama
y el doble sauce del río.

Canta de la parda encina
la rama que el hacha corta,
y la flor que nadie mira.

De los perales del huerto
la blanca flor, la rosada
flor del melocotonero.

Y este olor
que arranca el viento mojado
a los habares en flor.",CLIX,159,,,,,,,,,
50450,Antonio Machado,03-Nuevas canciones (1917-1930),,(Canciones),VIII,,"La fuente y las cuatro
acacias en flor
de la plazoleta.
Ya no quema el sol.
¡Tardecita alegre!
Canta, ruiseñor.
Es la misma hora
de mi corazón.",CLIX,159,,,,,,,,,
50451,Antonio Machado,03-Nuevas canciones (1917-1930),,(Canciones),IX,,"¡Blanca hospedería,
celda de viajero,
con la sombra mía!",CLIX,159,,,,,,,,,
50452,Antonio Machado,03-Nuevas canciones (1917-1930),,(Canciones),X,,"El acueducto romano,
-canta una coz de mi tierra-
y el querer que nos tenemos,
chiquilla, ¡vaya firmeza!",CLIX,159,,,,,,,,,
50453,Antonio Machado,03-Nuevas canciones (1917-1930),,(Canciones),XI,,"A las palabras de amor
les sienta bien su poquito
de exageración.",CLIX,159,,,,,,,,,
50454,Antonio Machado,03-Nuevas canciones (1917-1930),,(Canciones),XII,,"En Santo Domingo,
la misa mayor.
Aunque me decían
hereje y masón,
rezando contigo,
¡cuánta devoción!",CLIX,159,,,,,,,,,
50455,Antonio Machado,03-Nuevas canciones (1917-1930),,(Canciones),XIII,,"Hay fiesta en el prado verde 
—pífano y tambor—.
Con su cayado florido
y abarcas de oro vino un pastor.

Del monte bajé,
sólo por bailar con ella;
al monte me tornaré.

En los árboles del huerto
hay un ruiseñor;
canta de noche y de día,
canta a la luna y al sol.
Ronco de cantar:
al huerto vendrá la niña
y una rosa cortará.

Entre las negras encinas,
hay una fuente piedra,
y un cantarillo de barro
que nunca se llena.

Por el encinar,
con la blanca luna,
ella volverá.",CLIX,159,,,,,,,,,
50456,Antonio Machado,03-Nuevas canciones (1917-1930),,(Canciones),XIV,,"Contigo en Valonsadero,
fiesta de San Juan,
mañana en la Pampa,
del otro lado del mar.
Guárdame la fe,
que yo volveré.

Mañana seré pampero,
y se me irá el corazón
a orillas del alto Duero.",CLIX,159,,,,,,,,,
50457,Antonio Machado,03-Nuevas canciones (1917-1930),,(Canciones),XV,,"Mientras danzáis en corro,
niñas, cantad:
Ya están los prados verdes,
ya vino abril galán.

A la orilla del río,
por el negro encinar,
sus abarcas de plata
hemos visto brillar.
Ya están los prados verdes,
ya vino abril galán.",CLIX,159,,,,,,,,,
50458,Antonio Machado,03-Nuevas canciones (1917-1930),,(Canciones del alto Duero),I,,"Molinero es mi amante, 
tiene un molino 
bajo los pinos verdes, 
cerca del río. 
Niñas, cantad: 
«Por las tierras de Soria 
yo quisiera pasar.»",CLX,160,,,,,,,,,
50459,Antonio Machado,03-Nuevas canciones (1917-1930),,(Canciones del alto Duero),II,,"Por las tierras de Soria 
va mi pastor. 
¡Si yo fuera una encina 
sobre un alcor! 
Para la siesta, 
si yo fuera una encina 
sombra le diera.",CLX,160,,,,,,,,,
50460,Antonio Machado,03-Nuevas canciones (1917-1930),,(Canciones del alto Duero),III,,"Colmenero es mi amante 
y, en su abejar, 
abejicas de oro 
vienen y van. 
De tu colmena, 
colmenero del alma, 
yo colmenera.",CLX,160,,,,,,,,,
50461,Antonio Machado,03-Nuevas canciones (1917-1930),,(Canciones del alto Duero),IV,,"En las sierras de Soria, 
azul y nieve, 
leñador es mi amante 
de pinos verdes. 
¡Quién fuera águila
para ver a mi dueño 
cortando ramas!",CLX,160,,,,,,,,,
50462,Antonio Machado,03-Nuevas canciones (1917-1930),,(Canciones del alto Duero),V,,"Hortelano es mi amante, 
tiene su huerto, 
en la tierra de Soria, 
cerca del Duero. 
¡Linda hortelana! 
Llevaré saya verde, 
monjil de grana.",CLX,160,,,,,,,,,
50463,Antonio Machado,03-Nuevas canciones (1917-1930),,(Canciones del alto Duero),VI,,"A la orilla del Duero, 
lindas peonzas, 
bailad, coloraditas 
como amapolas. 

¡Ay, garabí!... 
Bailad, suene la flauta 
y el tamboril.",CLX,160,,,,,,,,,
50464,Antonio Machado,03-Nuevas canciones (1917-1930),,(Proverbios y cantares),I,A José Ortega y Gasset,"El ojo que ves no es
ojo porque tú lo veas;
es ojo porque te ve.",CLXI,161,,,,,,,,,
50465,Antonio Machado,03-Nuevas canciones (1917-1930),,(Proverbios y cantares),II,,"Para dialogar,
preguntad, primero;
después... escuchad.",CLXI,161,,,,,,,,,
50466,Antonio Machado,03-Nuevas canciones (1917-1930),,(Proverbios y cantares),III,,"Todo narcisismo
es un vicio feo,
y ya viejo vicio.",CLXI,161,,,,,,,,,
50467,Antonio Machado,03-Nuevas canciones (1917-1930),,(Proverbios y cantares),IV,,"Mas busca en tu espejo al otro,
al otro que va contigo.",CLXI,161,,,,,,,,,
50468,Antonio Machado,03-Nuevas canciones (1917-1930),,(Proverbios y cantares),V,,"Entre el vivir y el soñar
hay una tercera cosa.
Adivínala.",CLXI,161,,,,,,,,,
50469,Antonio Machado,03-Nuevas canciones (1917-1930),,(Proverbios y cantares),VI,,"Ese tu Narciso
ya no se ve en el espejo,
porque es el espejo mismo.",CLXI,161,,,,,,,,,
50470,Antonio Machado,03-Nuevas canciones (1917-1930),,(Proverbios y cantares),VII,,"¿Siglo nuevo? ¿Todavía
llamea la misma fragua?
¿Corre todavía el agua
por el cauce que tenía?",CLXI,161,,,,,,,,,
50471,Antonio Machado,03-Nuevas canciones (1917-1930),,(Proverbios y cantares),VIII,,Hoy es siempre todavía.,CLXI,161,,,,,,,,,
50472,Antonio Machado,03-Nuevas canciones (1917-1930),,(Proverbios y cantares),IX,,"Sol en Aries. Mi ventana
está abierta al aire frío.
―¡Oh rumor de agua lejana!―
La farde despierta al río.",CLXI,161,,,,,,,,,
50473,Antonio Machado,03-Nuevas canciones (1917-1930),,(Proverbios y cantares),X,,"En el viejo caserío,
―¡oh anchas torres con cigüeñas!―
enmudece el son gregario,
y en el campo solitario
suena el agua entre las peñas.",CLXI,161,,,,,,,,,
50474,Antonio Machado,03-Nuevas canciones (1917-1930),,(Proverbios y cantares),XI,,"Como otra vez, mi atención
está del agua cautiva;
pero del agua en la viva
roca de mi corazón.",CLXI,161,,,,,,,,,
50475,Antonio Machado,03-Nuevas canciones (1917-1930),,(Proverbios y cantares),XII,,"¿Sabes, cuando el agua suena,
si es agua de cumbre o valle,
de plaza, jardín o huerta?",CLXI,161,,,,,,,,,
50476,Antonio Machado,03-Nuevas canciones (1917-1930),,(Proverbios y cantares),XIII,,"Encuentro lo que no busco:
las hojas del toronjil
huelen a limón maduro.",CLXI,161,,,,,,,,,
50477,Antonio Machado,03-Nuevas canciones (1917-1930),,(Proverbios y cantares),XIV,,"Nunca traces tu frontera,
ni cuides de tu perfil;
todo eso es cosa defuera.",CLXI,161,,,,,,,,,
50478,Antonio Machado,03-Nuevas canciones (1917-1930),,(Proverbios y cantares),XV,,"Busca a tu complementario,
que marcha siempre contigo,
y suele ser tu contrario.",CLXI,161,,,,,,,,,
50479,Antonio Machado,03-Nuevas canciones (1917-1930),,(Proverbios y cantares),XVI,,"Si vino la primavera,
volad a las flores;
no chupéis cera.",CLXI,161,,,,,,,,,
50480,Antonio Machado,03-Nuevas canciones (1917-1930),,(Proverbios y cantares),XVII,,"En mi soledad
he visto cosas muy claras,
que no son verdad.",CLXI,161,,,,,,,,,
50481,Antonio Machado,03-Nuevas canciones (1917-1930),,(Proverbios y cantares),XVIII,,"Buena es el agua y la sed;
buena es la sombra y el sol;
la miel de flor de romero,
a miel de campo sin flor.",CLXI,161,,,,,,,,,
50482,Antonio Machado,03-Nuevas canciones (1917-1930),,(Proverbios y cantares),XIX,,"A la vera del camino
hay una fuente de piedra,
y un cantarillo de barro
―glu-glu― que nadie se lleva.",CLXI,161,,,,,,,,,
50483,Antonio Machado,03-Nuevas canciones (1917-1930),,(Proverbios y cantares),XX,,"Adivina adivinanza,
que quieren decir la fuente,
el cantarillo y el agua.",CLXI,161,,,,,,,,,
50484,Antonio Machado,03-Nuevas canciones (1917-1930),,(Proverbios y cantares),XXI,,"... Pero yo he visto beber
hasta en los charcos del suelo.
Caprichos tiene la sed…",CLXI,161,,,,,,,,,
50485,Antonio Machado,03-Nuevas canciones (1917-1930),,(Proverbios y cantares),XXII,,"Solo quede un símbolo:
quod elixum est ne asato.
No aséis lo que está cocido.",CLXI,161,,,,,,,,,
50486,Antonio Machado,03-Nuevas canciones (1917-1930),,(Proverbios y cantares),XXIII,,"Canta, canta, canta,
junto a su tomate,
el grillo en su jaula.",CLXI,161,,,,,,,,,
50487,Antonio Machado,03-Nuevas canciones (1917-1930),,(Proverbios y cantares),XXIV,,"Despacito y buena letra:
el hacer las cosas bien
importa más que el hacerlas.",CLXI,161,,,,,,,,,
50488,Antonio Machado,03-Nuevas canciones (1917-1930),,(Proverbios y cantares),XXV,,"Sin embargo...
¡Ah!, sin embargo,
importa avivar los remos,
dijo el caracol al galgo.",CLXI,161,,,,,,,,,
50489,Antonio Machado,03-Nuevas canciones (1917-1930),,(Proverbios y cantares),XXVI,,"¡Ya hay hombres activos!
Soñaba la charca
con los mosquitos.",CLXI,161,,,,,,,,,
50490,Antonio Machado,03-Nuevas canciones (1917-1930),,(Proverbios y cantares),XXVII,,"¡Oh calavera vacía!
¡Y pensar que todo era,
dentro de ti, calavera!,
otra Pandolfo decía.",CLXI,161,,,,,,,,,
50491,Antonio Machado,03-Nuevas canciones (1917-1930),,(Proverbios y cantares),XXVIII,,"Cantores, dejad
palmas y jaleo
para los demás.",CLXI,161,,,,,,,,,
50492,Antonio Machado,03-Nuevas canciones (1917-1930),,(Proverbios y cantares),XXIX,,"Despertad, cantores:
acaben los ecos,
empiecen las voces.",CLXI,161,,,,,,,,,
50493,Antonio Machado,03-Nuevas canciones (1917-1930),,(Proverbios y cantares),XXX,,"Mas no busquéis disonancias;
porque, al fin, nada disuena,
siempre al son que tocan bailan.",CLXI,161,,,,,,,,,
50494,Antonio Machado,03-Nuevas canciones (1917-1930),,(Proverbios y cantares),XXXI,,"Luchador superfluo,
ayer lo más noble,
mañana lo más plebeyo.",CLXI,161,,,,,,,,,
50495,Antonio Machado,03-Nuevas canciones (1917-1930),,(Proverbios y cantares),XXXII,,"Camorrista, boxeador,
zúrratelas con el viento.",CLXI,161,,,,,,,,,
50496,Antonio Machado,03-Nuevas canciones (1917-1930),,(Proverbios y cantares),XXXIII,,"-Sin embargo...
¡Oh!, sin embargo,
queda un fetiche que aguarda
ofrenda de puñetazos.",CLXI,161,,,,,,,,,
50497,Antonio Machado,03-Nuevas canciones (1917-1930),,(Proverbios y cantares),XXXIV,,"O rinnovarsi o perire...
No me suena bien.
Navigare é necessario...
Mejor: ¡vivir para ver!",CLXI,161,,,,,,,,,
50498,Antonio Machado,03-Nuevas canciones (1917-1930),,(Proverbios y cantares),XXXV,,"Ya maduró un nuevo cero,
que tendrá su devoción:
un ente de acción tan huero
como un ente de razón.",CLXI,161,,,,,,,,,
50499,Antonio Machado,03-Nuevas canciones (1917-1930),,(Proverbios y cantares),XXXVI,,"No es el yo fundamental
eso que busca el poeta,
sino el tú esencial.",CLXI,161,,,,,,,,,
50500,Antonio Machado,03-Nuevas canciones (1917-1930),,(Proverbios y cantares),XXXVII,,"Viejo como el mundo es
—dijo un doctor—, olvidado,
por sabido, y enterrado
cual la momia de Ramsés.",CLXI,161,,,,,,,,,
50501,Antonio Machado,03-Nuevas canciones (1917-1930),,(Proverbios y cantares),XXXVIII,,"Mas el doctor no sabía
que hoy es siempre todavía.",CLXI,161,,,,,,,,,
50502,Antonio Machado,03-Nuevas canciones (1917-1930),,(Proverbios y cantares),XXXIX,,"Busca en tu prójimo espejo;
pero no para afeitarte,
ni para teñirte el pelo.",CLXI,161,,,,,,,,,
50503,Antonio Machado,03-Nuevas canciones (1917-1930),,(Proverbios y cantares),XL,,"Los ojos porque suspiras,
sábelo bien,
los ojos en que te miras
son ojos porque te ven.",CLXI,161,,,,,,,,,
50504,Antonio Machado,03-Nuevas canciones (1917-1930),,(Proverbios y cantares),XLI,,"―Ya se oyen palabras viejas.
―Pues, aguzad las orejas.",CLXI,161,,,,,,,,,
50505,Antonio Machado,03-Nuevas canciones (1917-1930),,(Proverbios y cantares),XLII,,"Enseña el Cristo: a tu prójimo
amarás como a ti mismo,
mas nunca olvides que es otro.",CLXI,161,,,,,,,,,
50506,Antonio Machado,03-Nuevas canciones (1917-1930),,(Proverbios y cantares),XLIII,,"Dijo otra verdad:
busca el tú que nunca es tuyo
ni puede serlo jamás.",CLXI,161,,,,,,,,,
50507,Antonio Machado,03-Nuevas canciones (1917-1930),,(Proverbios y cantares),XLIV,,"No desdeñéis la palabra;
el mundo es ruidoso y mudo,
poetas, sólo Dios habla.",CLXI,161,,,,,,,,,
50508,Antonio Machado,03-Nuevas canciones (1917-1930),,(Proverbios y cantares),XLV,,"¿Todo para los demás?
Mancebo, llena tu jarro,
que ya te lo beberán.",CLXI,161,,,,,,,,,
50509,Antonio Machado,03-Nuevas canciones (1917-1930),,(Proverbios y cantares),XLVI,,"Se miente más de la cuenta
por falta de fantasía:
también la verdad se inventa.",CLXI,161,,,,,,,,,
50510,Antonio Machado,03-Nuevas canciones (1917-1930),,(Proverbios y cantares),XLVII,,"Autores, la escena acaba
con un dogma de teatro:
en el principio era la máscara.",CLXI,161,,,,,,,,,
50511,Antonio Machado,03-Nuevas canciones (1917-1930),,(Proverbios y cantares),XLVIII,,"Será el peor de los malos
bribón que olvide
su vocación de diablo.",CLXI,161,,,,,,,,,
50512,Antonio Machado,03-Nuevas canciones (1917-1930),,(Proverbios y cantares),XLIX,,"¿Dijiste media verdad?
Dirán que mientes dos veces
si dices la otra mitad.",CLXI,161,,,,,,,,,
50513,Antonio Machado,03-Nuevas canciones (1917-1930),,(Proverbios y cantares),L,,"Con el tú de mi canción
no te aludo, compañero;
ese tú soy yo.",CLXI,161,,,,,,,,,
50514,Antonio Machado,03-Nuevas canciones (1917-1930),,(Proverbios y cantares),LI,,"Demos tiempo al tiempo:
para que el vaso rebose
hay que llenarlo primero.",CLXI,161,,,,,,,,,
50515,Antonio Machado,03-Nuevas canciones (1917-1930),,(Proverbios y cantares),LII,,"Hora de mi corazón:
la hora de una esperanza
y una desesperación.",CLXI,161,,,,,,,,,
50516,Antonio Machado,03-Nuevas canciones (1917-1930),,(Proverbios y cantares),LIII,,"Tras el vivir y el soñar,
está lo que más importa:
despertar.",CLXI,161,,,,,,,,,
50517,Antonio Machado,03-Nuevas canciones (1917-1930),,(Proverbios y cantares),LIV,,"Le tiembla al cantar la voz.
Ya no le silban sus coplas;
que silban su corazón.",CLXI,161,,,,,,,,,
50518,Antonio Machado,03-Nuevas canciones (1917-1930),,(Proverbios y cantares),LV,,"Ya hubo quien pensó:
cogita ergo non sum.
¡Qué exageración!",CLXI,161,,,,,,,,,
50519,Antonio Machado,03-Nuevas canciones (1917-1930),,(Proverbios y cantares),LVI,,"Conversación de gitanos:
―¿Cómo vamos, compadrito?
―Dando vueltas al atajo.",CLXI,161,,,,,,,,,
50520,Antonio Machado,03-Nuevas canciones (1917-1930),,(Proverbios y cantares),LVII,,"Algunos desesperados
sólo se curan con soga;
otros, con siete palabras:
la fe se ha puesto de moda.",CLXI,161,,,,,,,,,
50521,Antonio Machado,03-Nuevas canciones (1917-1930),,(Proverbios y cantares),LVIII,,"Creí mi hogar apagado,
y revolví la ceniza...
Me quemé la mano.",CLXI,161,,,,,,,,,
50522,Antonio Machado,03-Nuevas canciones (1917-1930),,(Proverbios y cantares),LIX,,"¡Reventó de risa!
¡Un hombre tan serio!
... Nadie lo diría.",CLXI,161,,,,,,,,,
50523,Antonio Machado,03-Nuevas canciones (1917-1930),,(Proverbios y cantares),LX,,"Que se divida el trabajo:
los malos unten la flecha;
los buenos tiendan el arco.",CLXI,161,,,,,,,,,
50524,Antonio Machado,03-Nuevas canciones (1917-1930),,(Proverbios y cantares),LXI,,"Como don San Tob,
se tiñe las canas,
y con más razón.",CLXI,161,,,,,,,,,
50525,Antonio Machado,03-Nuevas canciones (1917-1930),,(Proverbios y cantares),LXII,,"Por dar al viento trabajo,
cosía con hilo doble
las hojas secas del árbol.",CLXI,161,,,,,,,,,
50526,Antonio Machado,03-Nuevas canciones (1917-1930),,(Proverbios y cantares),LXIII,,"Sentía los cuatro vientos,
en la encrucijada
de su pensamiento.",CLXI,161,,,,,,,,,
50527,Antonio Machado,03-Nuevas canciones (1917-1930),,(Proverbios y cantares),LXIV,,"¿Conoces los invisibles
hiladores de los sueños?
Son dos: la verde esperanza,
y el torvo miedo.

Apuesta tienen de quien
hile más, y más ligero,
ella, su copo dorado;
él, su copo negro.

Con el hilo que nos dan
tejemos, cuando tejemos.",CLXI,161,,,,,,,,,
50528,Antonio Machado,03-Nuevas canciones (1917-1930),,(Proverbios y cantares),LXV,,"Siembra la malva;
pero no la comas,
dijo Pitágoras.

Responde al hachazo,
―ha dicho el Bada ¡y el Cristo!―
con tu aroma, como el sándalo.

Bueno es recordar
las palabras viejas
que han de volver a sonar.",CLXI,161,,,,,,,,,
50529,Antonio Machado,03-Nuevas canciones (1917-1930),,(Proverbios y cantares),LXVI,,"Poned atención:
un corazón solitario
no es un corazón.",CLXI,161,,,,,,,,,
50530,Antonio Machado,03-Nuevas canciones (1917-1930),,(Proverbios y cantares),LXVII,,"Abejas, cantores,
no a la miel sino a las flores.",CLXI,161,,,,,,,,,
50531,Antonio Machado,03-Nuevas canciones (1917-1930),,(Proverbios y cantares),LXVIII,,"Todo necio
confunde calor y precio.",CLXI,161,,,,,,,,,
50532,Antonio Machado,03-Nuevas canciones (1917-1930),,(Proverbios y cantares),LXIX,,"Lo ha visto pasar en sueños...
Buen cazador de sí mismo,
siempre en acecho.",CLXI,161,,,,,,,,,
50533,Antonio Machado,03-Nuevas canciones (1917-1930),,(Proverbios y cantares),LXX,,"Cazó a su hombre malo,
el de los días azules,
siempre cabizbajo.",CLXI,161,,,,,,,,,
50534,Antonio Machado,03-Nuevas canciones (1917-1930),,(Proverbios y cantares),LXXI,,"Da doble luz a tu verso,
para leído de frente
y al sesgo.",CLXI,161,,,,,,,,,
50535,Antonio Machado,03-Nuevas canciones (1917-1930),,(Proverbios y cantares),LXXII,,"Mas no te importe si rueda,
y pasa de mano en mano:
del oro se hace moneda.",CLXI,161,,,,,,,,,
50536,Antonio Machado,03-Nuevas canciones (1917-1930),,(Proverbios y cantares),LXXIII,,"De un «Arte de Bien Comer»,
primera lección:
No has de coger la cuchara
con el tenedor.",CLXI,161,,,,,,,,,
50537,Antonio Machado,03-Nuevas canciones (1917-1930),,(Proverbios y cantares),LXXIV,,"Señor San Jerónimo,
suelte usted la piedra
con que se machaca.
Me pegó con ella.",CLXI,161,,,,,,,,,
50538,Antonio Machado,03-Nuevas canciones (1917-1930),,(Proverbios y cantares),LXXV,,"Conversación de gitanos:
―Para rodear,
toma la calle de en medio;
nunca llegarás.",CLXI,161,,,,,,,,,
50539,Antonio Machado,03-Nuevas canciones (1917-1930),,(Proverbios y cantares),LXXVI,,"El tono lo da la lengua,
ni más alto ni más bajo;
sólo acompáñate de ella.",CLXI,161,,,,,,,,,
50540,Antonio Machado,03-Nuevas canciones (1917-1930),,(Proverbios y cantares),LXXVII,,"¡Tartarín en Koenigsberg!
Con el puño en la mejilla,
todo lo llegó a saber.",CLXI,161,,,,,,,,,
50541,Antonio Machado,03-Nuevas canciones (1917-1930),,(Proverbios y cantares),LXXVIII,,"Crisolad oro en copela,
y burilad lira y arco,
no en joya, sino en moneda.",CLXI,161,,,,,,,,,
